{"run":22,"commit":"4045564","metric":3.275341432720231,"metrics":{"update_p95_ms":2.269259,"section_mean_us":0.66036,"section_alloc_kib":0.0047265625,"core_mean_us":17.326796,"delivered_fps":11.22738259708794,"redraw_fps":4.95325702812703,"max_rss_kib":40848},"status":"discard","description":"Confirmation rerun after skipping whitespace extmarks","timestamp":1784453782142,"segment":1,"confidence":5.066598188355569,"asi":{"hypothesis":"Confirm the small whitespace-extmark gain under identical code.","finding":"Machine noise spiked to 3.275% CPU with unchanged code. This does not isolate the whitespace change; structural direct-extmark gain remains large, but sub-3% refinements are currently hard to resolve.","rollback_reason":"No code change and metric did not improve stored best.","next_action_hint":"Continue only with changes that remove substantial API work or allocations; avoid interpreting small deltas."}}
{"run":23,"commit":"480476c","metric":2.933781493440881,"metrics":{"update_p95_ms":1.45824,"section_mean_us":0.54282,"section_alloc_kib":0.0047265625,"core_mean_us":17.766544,"delivered_fps":11.23142939884137,"redraw_fps":4.95504238184178,"max_rss_kib":40116},"status":"keep","description":"Precompute segment visibility for whitespace extmark skipping","timestamp":1784453850319,"segment":1,"confidence":5.776543641357396,"asi":{"hypothesis":"Whitespace visibility is immutable for parsed segments; precomputing it removes 1,124 pattern scans from each extmark frame while preserving whitespace skipping.","finding":"CPU improved slightly from 2.943% to 2.934% and RSS fell 3.3%. Core diagnostic rose because shifted segments now compute visibility when created, but core remains tiny and real CPU improved.","tradeoff":"Moves whitespace detection from every rendered frame to parse time and only newly clipped glitch segments. Adds one boolean per segment.","next_action":"Investigate precomputing shade/tint metadata only if it removes substantial per-extmark Lua work; otherwise stop local micro-tuning."}}
{"run":24,"commit":"439ce04","metric":2.704383311909162,"metrics":{"update_p95_ms":1.317637,"section_mean_us":0.500952,"section_alloc_kib":0.0047265625,"core_mean_us":16.155702,"delivered_fps":11.22284528565515,"redraw_fps":4.951255273083152,"max_rss_kib":40736},"status":"keep","description":"Merge adjacent visible segments into single extmark spans","timestamp":1784453955391,"segment":1,"confidence":8.362762400537907,"asi":{"hypothesis":"After whitespace removal, adjacent visible segments with identical final highlights can share one extmark; default frame count drops about 9.1% with exact output.","finding":"CPU improved 7.8% from 2.934% to 2.704%; redraw p95 improved 9.6%. Delivered FPS and redraw rate held. This confirms extmark API call count is now the dominant controllable cost.","safety":"Only contiguous equal-highlight spans merge; whitespace gaps flush spans. Highlight coverage and text are unchanged.","next_action":"Look for additional exact extmark-call reductions, especially pre-grouping immutable segment runs without adding large caches."}}
{"run":25,"commit":"d468834","metric":2.004615050027584,"metrics":{"update_p95_ms":0,"section_mean_us":0.526332,"section_alloc_kib":0.0047265625,"core_mean_us":16.038616,"delivered_fps":11.22053762588905,"redraw_fps":0,"max_rss_kib":39928},"status":"keep","description":"Update single-pane logo geometry without full Snacks redraw","timestamp":1784454076586,"segment":1,"confidence":7.880066848591616,"asi":{"hypothesis":"Dashboard-logo owns a fixed-count single-pane row range, so geometry glitches can update only those buffer lines and custom extmarks instead of rebuilding all Snacks layout, keymaps, lines, and namespaces.","finding":"CPU improved 31.7% from 2.704% to 2.005%; full Snacks redraws during soak fell to zero, delivered animation remained 11.22 FPS, and RSS fell. Combined improvement versus frame-aware baseline is 51.5%.","safety":"Direct path is restricted to valid single-pane dashboards; other layouts fall back to the existing opts.update full redraw. Row count stays fixed. Generation/lifecycle/extmark/FPS checks passed.","next_action":"Add a differential geometry correctness check against Snacks layout math and confirm performance unchanged; update docs for single-pane direct geometry/fallback semantics."}}
{"run":26,"commit":"b1de963","metric":1.999795420462672,"metrics":{"update_p95_ms":0,"section_mean_us":0.552162,"section_alloc_kib":0.0047265625,"core_mean_us":16.364778,"delivered_fps":11.23239295850707,"redraw_fps":0,"max_rss_kib":39316},"status":"keep","description":"Reuse extmark option table and lock direct-geometry correctness","timestamp":1784454193592,"segment":1,"confidence":7.470881392437225,"asi":{"hypothesis":"Neovim consumes extmark option tables synchronously, so one reusable table removes hundreds of Lua table allocations per frame; add deterministic geometry checks concurrently without affecting workload.","finding":"CPU improved marginally from 2.005% to 2.000%, RSS fell 1.5%, and frame rate held. More importantly, deterministic test now forces a geometry glitch, verifies no full update, and compares every direct buffer row against Snacks centering math.","safety":"Custom README documents single-pane direct geometry and multi-pane fallback. Correctness test validates namespace extmarks, direct row contents, frame callback, timer lifecycle, and zero fallback redraws.","next_action":"Confirm current best; then inspect whether update_geometry can reuse row storage or reduce buffer writes without weakening differential coverage."}}
{"run":27,"commit":"b1de963","metric":2.048451394868412,"metrics":{"update_p95_ms":0,"section_mean_us":0.524536,"section_alloc_kib":0.0047265625,"core_mean_us":14.655742,"delivered_fps":11.22764821794009,"redraw_fps":0,"max_rss_kib":39168},"status":"discard","description":"Confirmation rerun of direct geometry and reusable extmark options","timestamp":1784454242308,"segment":1,"confidence":7.2658410339199895,"asi":{"hypothesis":"Confirm the approximately 2.0% CPU current best after adding deterministic geometry coverage.","finding":"Unchanged code measured 2.048% (+2.4%), within established noise. Zero full redraws and 11.23 FPS reproduced; architecture result is stable.","rollback_reason":"No code change and metric did not beat stored best.","next_action_hint":"Proceed with only material reductions; current remaining cost is dedicated extmark recreation and core frame generation."}}
{"run":28,"commit":"1ca44b5","metric":1.661504754225401,"metrics":{"update_p95_ms":0,"section_mean_us":0.526212,"section_alloc_kib":0.0047265625,"core_mean_us":16.041912,"delivered_fps":11.24586946077994,"redraw_fps":0,"max_rss_kib":38196},"status":"keep","description":"Use native buffer highlight API for logo spans","timestamp":1784454327437,"segment":1,"confidence":6.671889242000689,"asi":{"hypothesis":"nvim_buf_add_highlight is the native specialized path for foreground ranges and should be cheaper than generic nvim_buf_set_extmark option parsing.","finding":"CPU improved 16.9% from 2.000% to 1.662%; RSS fell 2.8%. Delivered animation stayed 11.25 FPS and zero full redraws remained. Specialized native API is materially faster and deletes option-table handling.","safety":"Highlights remain in the same custom namespace and correctness tests inspect them through extmark APIs. Geometry and lifecycle checks passed.","next_action":"Confirm result. Then profile whether namespace clearing or Lua span construction is the next ceiling."}}
{"run":29,"commit":"da0d31f","metric":1.627171224260774,"metrics":{"update_p95_ms":0,"section_mean_us":0.570504,"section_alloc_kib":0.0047265625,"core_mean_us":24.764478,"delivered_fps":11.24925205873654,"redraw_fps":0,"max_rss_kib":39352},"status":"keep","description":"Confirmation rerun of native highlight renderer","timestamp":1784454372746,"segment":1,"confidence":5.602352699257884,"asi":{"hypothesis":"Repeat the specialized buffer-highlight implementation unchanged to verify the 16.9% step improvement.","finding":"Confirmed at 1.627% CPU, slightly better than first run. Zero redraws and 11.25 FPS reproduced. Core microbenchmark noise rose but remains negligible relative to rendering.","next_action":"Test narrower namespace clearing or precomputed span metadata; reject anything that does not materially beat 1.627%."}}
{"run":30,"commit":"da0d31f","metric":1.706653162014507,"metrics":{"update_p95_ms":0,"section_mean_us":0.809888,"section_alloc_kib":0.0047265625,"core_mean_us":23.090212,"delivered_fps":11.21554580206244,"redraw_fps":0,"max_rss_kib":38936},"status":"discard","description":"Cache immutable highlight spans by line geometry","timestamp":1784454459796,"segment":1,"confidence":3.6482495510811592,"asi":{"hypothesis":"Cache visible merged span geometry by line text so color frames iterate 841 spans instead of 1,124 source segments and branches.","finding":"CPU regressed 4.9%. Nested cache lookups, span tables, and indirection cost more than the straightforward hot loop; native highlight calls dominate and LuaJIT handles the simple segment traversal well.","rollback_reason":"Primary regression with no memory benefit and worse section diagnostic.","next_action_hint":"Keep direct segment loop. Avoid geometry caches and table-rich precomputation."}}
{"run":31,"commit":"da0d31f","metric":1.896516009856701,"metrics":{"update_p95_ms":0,"section_mean_us":0.512036,"section_alloc_kib":0.0047265625,"core_mean_us":15.618284,"delivered_fps":11.2337185252836,"redraw_fps":0,"max_rss_kib":38952},"status":"discard","description":"Use numeric loops in dedicated highlight renderer","timestamp":1784454543200,"segment":1,"confidence":2.800205789467496,"asi":{"hypothesis":"Numeric loops should reduce iterator overhead in the now-dominant dedicated highlight traversal.","finding":"CPU regressed 16.5%. LuaJIT's ipairs path is better optimized for these dense tables in this workload, consistent with the earlier section-loop experiment.","rollback_reason":"Large primary regression with no secondary benefit.","next_action_hint":"Stop revisiting numeric loops. Keep ipairs for frame and segment traversal."}}
{"run":32,"commit":"da0d31f","metric":1.80347908071756,"metrics":{"update_p95_ms":0,"section_mean_us":0.512992,"section_alloc_kib":0.0047265625,"core_mean_us":14.768792,"delivered_fps":11.23642387795661,"redraw_fps":0,"max_rss_kib":38616},"status":"discard","description":"Skip tint and highlight lookup for whitespace segments","timestamp":1784454615027,"segment":1,"confidence":2.7473226851668575,"asi":{"hypothesis":"Avoid tint/highlight lookup for 184 whitespace segments and only resolve highlight names when a new visible color run begins.","finding":"CPU regressed 10.8%. The added Lua branch/state logic costs more than cached filter/highlight calls; those cache hits are extremely cheap under LuaJIT.","rollback_reason":"Strong primary regression despite fewer function calls.","next_action_hint":"Keep the simple existing branch. Native highlight API calls, not cached Lua lookups, dominate."}}
{"run":33,"commit":"da0d31f","metric":1.872067108073636,"metrics":{"update_p95_ms":0,"section_mean_us":0.509548,"section_alloc_kib":0.0047265625,"core_mean_us":16.799326,"delivered_fps":11.22817557057995,"redraw_fps":0,"max_rss_kib":39256},"status":"discard","description":"Reuse direct-geometry row table","timestamp":1784454663908,"segment":1,"confidence":2.6963999983818336,"asi":{"hypothesis":"Reuse the 35-entry geometry row array instead of allocating it on each glitch frame.","finding":"CPU regressed 15.1%. Fresh short-lived row arrays are cheaper than retaining and clearing the table under this GC/JIT behavior; string construction remains the actual geometry cost.","rollback_reason":"Large primary regression and no memory improvement.","next_action_hint":"Retain local fresh rows. Stop generic allocation-reuse experiments; measured LuaJIT/GC behavior favors simple ephemeral tables here."}}
{"run":34,"commit":"da0d31f","metric":1.897855909603432,"metrics":{"update_p95_ms":0,"section_mean_us":0.548156,"section_alloc_kib":0.0047265625,"core_mean_us":14.006136,"delivered_fps":11.22575449946012,"redraw_fps":0,"max_rss_kib":39164},"status":"discard","description":"Use captured dashboard buffer for visibility checks","timestamp":1784454729994,"segment":1,"confidence":3.0670515671269376,"asi":{"hypothesis":"Captured dashboard buffer should avoid scanning all windows on every timer tick while preserving fallback discovery.","finding":"CPU regressed 16.6%. Two buffer API checks plus option access cost more than scanning the normal one-window dashboard case.","rollback_reason":"Clear primary regression; existing window scan is already cheap for this workload.","next_action_hint":"Retain dashboard_visible scan. Do not optimize one-window lifecycle checks."}}
{"run":35,"commit":"da0d31f","metric":1.978428517651745,"metrics":{"update_p95_ms":0,"section_mean_us":0.821048,"section_alloc_kib":0.0047265625,"core_mean_us":16.32788,"delivered_fps":11.23556210854661,"redraw_fps":0,"max_rss_kib":39500},"status":"discard","description":"Localize hot Neovim and tint functions","timestamp":1784454820925,"segment":1,"confidence":3.49160415684237,"asi":{"hypothesis":"Closure-local references should avoid repeated table lookups for highlight, namespace clear, and tint calls.","finding":"CPU regressed 21.6% and section diagnostic worsened. LuaJIT already optimizes stable table lookups; extra closure upvalues hurt this trace.","rollback_reason":"Large primary regression with no benefit.","next_action_hint":"Keep direct table-qualified API calls. Avoid conventional micro-optimization assumptions without measurement."}}
{"run":36,"commit":"ab2162f","metric":1.419188641849333,"metrics":{"update_p95_ms":0,"section_mean_us":0.82018,"section_alloc_kib":0.0047265625,"core_mean_us":20.133954,"delivered_fps":11.22404141870675,"redraw_fps":0,"max_rss_kib":39088},"status":"keep","description":"Render each logo line as one virtual-text extmark","timestamp":1784454903855,"segment":1,"confidence":4.50841009098923,"asi":{"hypothesis":"One overlay virtual-text extmark per logo line can carry all colored chunks, replacing roughly 841 range-highlight API calls with 35 generic extmark calls per frame.","finding":"CPU improved 12.8% from 1.627% to 1.419% while keeping 11.22 FPS and zero full redraws. The large API call-count reduction outweighs chunk table processing. RSS stayed comparable.","safety":"Buffer retains exact plain logo text; overlay chunks reuse the same segment text and highlight names. Existing namespace, direct geometry, lifecycle, and FPS checks pass.","next_action":"Add a correctness assertion that virtual-text chunks reconstruct each logo line and then confirm performance. Consider merging equal-highlight chunks only if it reduces C conversion cost without string-allocation regression."}}
{"run":37,"commit":"ab2162f","metric":1.373365034113767,"metrics":{"update_p95_ms":0,"section_mean_us":0.852104,"section_alloc_kib":0.0047265625,"core_mean_us":17.897512,"delivered_fps":11.2209683997573,"redraw_fps":0,"max_rss_kib":38052},"status":"checks_failed","description":"Compact whitespace-only ANSI segments into neighboring chunks","timestamp":1784454995287,"segment":1,"confidence":4.136689964972294,"asi":{"hypothesis":"Whitespace foreground is invisible, so attaching whitespace-only ANSI segments to neighboring visible chunks should reduce virtual-text chunk conversion by about 16%.","finding":"CPU improved 3.2% to 1.373%, but generation contract failed at tests/generate.lua:44 because the first segment's original ANSI color metadata changed. Visual output may match, but public parsed-segment semantics did not.","rollback_reason":"Correctness checks failed; optimization changed segment boundary/color metadata relied on by tests and public renderer consumers.","next_action_hint":"Preserve parsed segment metadata. If revisiting chunk compaction, do it only inside Snacks virtual-text preparation with separate cached chunk text, not in logos parser. Re-add virtual-text reconstruction assertion independently."}}
{"run":38,"commit":"d65119d","metric":1.220079617873727,"metrics":{"update_p95_ms":0,"section_mean_us":0.515394,"section_alloc_kib":0.0047265625,"core_mean_us":15.256576,"delivered_fps":11.20972464133026,"redraw_fps":0,"max_rss_kib":37160},"status":"keep","description":"Cache display-only chunks with whitespace folded into neighbors","timestamp":1784455074012,"segment":1,"confidence":4.37634261150368,"asi":{"hypothesis":"Preserve public ANSI segment metadata, but cache Snacks-only display chunks per line geometry with whitespace folded into neighboring visible chunks; this reduces virtual-text chunk conversion by ~16%.","finding":"CPU improved 14.0% from 1.419% to 1.220%; RSS fell 4.9%. Delivered FPS stayed 11.21 and full redraws remained zero. Adapter-local compaction succeeds where parser mutation failed.","safety":"Generation metadata remains unchanged. New correctness assertion reads detailed extmarks and proves each line's virtual-text chunks concatenate exactly to the underlying logo text.","next_action":"Confirm. Then test whether chunk cache can key directly by stable segments table instead of line text, or whether current 1.22% is near practical floor."}}
{"run":39,"commit":"23a9b29","metric":1.13018374037864,"metrics":{"update_p95_ms":0,"section_mean_us":0.516426,"section_alloc_kib":0.0047265625,"core_mean_us":14.713012,"delivered_fps":11.2033141411918,"redraw_fps":0,"max_rss_kib":37904},"status":"keep","description":"Confirmation rerun of cached display chunks","timestamp":1784455117317,"segment":1,"confidence":4.290551663953999,"asi":{"hypothesis":"Repeat adapter-local whitespace chunk compaction unchanged to confirm the 14% CPU step.","finding":"Confirmed at 1.130% CPU, another favorable sample; zero redraws, exact virtual-text reconstruction, and 11.20 FPS reproduced.","next_action":"Test a leaner cache key only if it preserves geometry correctness. Remaining CPU is close to process/timer floor, so reject added complexity for marginal gains."}}
{"run":40,"commit":"23a9b29","metric":1.654407694441726,"metrics":{"update_p95_ms":0,"section_mean_us":0.527796,"section_alloc_kib":0.0047265625,"core_mean_us":14.967208,"delivered_fps":11.20225073407657,"redraw_fps":0,"max_rss_kib":37776},"status":"discard","description":"Merge adjacent display chunks with equal quantized shade","timestamp":1784455184650,"segment":1,"confidence":4.511420963160855,"asi":{"hypothesis":"Adjacent source colors with the same quantized luminance produce identical filtered colors, so cached display chunks can merge another ~9% exactly.","finding":"CPU regressed 46%. Extra shade computation/metadata during cache construction and larger concatenated strings outweigh fewer virtual-text chunks, or triggered an unfavorable C conversion path.","rollback_reason":"Severe primary regression despite exact reconstruction checks passing.","next_action_hint":"Keep only whitespace compaction. Do not merge distinct source-color chunks even when final highlight is equal."}}
{"run":41,"commit":"209f6fb","metric":1.07668985162011,"metrics":{"update_p95_ms":0,"section_mean_us":0.523286,"section_alloc_kib":0.0047265625,"core_mean_us":15.492936,"delivered_fps":11.21187850303128,"redraw_fps":0,"max_rss_kib":35692},"status":"keep","description":"Merge adjacent equal-highlight virtual-text chunks per frame","timestamp":1784455297035,"segment":1,"confidence":4.337125014855313,"asi":{"hypothesis":"After adapter-local whitespace compaction, merge adjacent chunks with the same resolved highlight using reused tables and only a small number of string concatenations per frame.","finding":"CPU improved 4.7% from 1.130% to 1.077%; RSS fell 5.8%. This runtime merge succeeds because it avoids the table-rich shade cache and reuses chunk entries while reducing C virtual-text conversion.","safety":"Detailed extmark test still proves chunk text concatenates exactly to every logo line. Highlight equality is resolved before merging, so colors remain exact.","next_action":"Confirm. Then measure idle floor again; remaining headroom may be small enough to stop adding complexity."}}
{"run":42,"commit":"209f6fb","metric":1.102113670394688,"metrics":{"update_p95_ms":0,"section_mean_us":0.499196,"section_alloc_kib":0.0047265625,"core_mean_us":14.886278,"delivered_fps":11.21473381860122,"redraw_fps":0,"max_rss_kib":38116},"status":"discard","description":"Confirmation rerun of merged virtual-text chunks","timestamp":1784455335579,"segment":1,"confidence":4.117601783835186,"asi":{"hypothesis":"Confirm the equal-highlight virtual chunk merge unchanged.","finding":"Repeated at 1.102% CPU, 2.4% above stored best and within noise. Zero redraws, exact text reconstruction, and 11.21 FPS remain stable.","rollback_reason":"No code change and metric did not beat stored best.","next_action_hint":"Current result is confirmed within noise. Prefer measurement or cleanup over further clever caching."}}
