{"type":"config","name":"Reduce dashboard logo animation load","metricName":"cpu_percent","metricUnit":"","bestDirection":"lower"}
{"run":1,"commit":"f8e2407","metric":4.974965059517766,"metrics":{"update_p95_ms":7.122387,"section_mean_us":798.54846,"section_alloc_kib":146.0884609375,"core_mean_us":10.980102,"delivered_fps":11.22920024321391,"max_rss_kib":52876},"status":"keep","description":"Baseline: locked real-config soak benchmark and correctness gates","timestamp":1784451946683,"segment":0,"confidence":null,"asi":{"hypothesis":"Establish stable real-config CPU baseline while preserving 90 ms cadence and visual behavior.","workload":"Three 3-second Snacks dashboard soaks after 1-second warmup; median CPU; default grudge_axe glitch; 10-13 FPS gate.","anti_cheat":"Benchmark and checks locked; cadence, timer cleanup, generation, and lifecycle behavior enforced.","finding":"Baseline CPU 4.975%; full redraw p95 7.122 ms; section serialization 798.5 µs and 146.1 KiB/call."}}
{"run":2,"commit":"48de175","metric":4.157217674577288,"metrics":{"update_p95_ms":8.571371,"section_mean_us":203.249244,"section_alloc_kib":145.828515625,"core_mean_us":12.229648,"delivered_fps":11.21772821630603,"max_rss_kib":53296},"status":"keep","description":"Cache filtered color results across animation frames","timestamp":1784452013836,"segment":0,"confidence":null,"asi":{"hypothesis":"Source/filter color pairs repeat across frames; memoizing exact tint results removes repeated RGB parsing, luminance math, and formatting without changing output.","finding":"CPU improved 16.4%; section mean fell from 798.5 µs to 203.2 µs. Allocation stayed ~146 KiB because section tables/strings still rebuild. Full-update p95 rose, likely soak noise or GC variance; cadence unchanged.","next_action":"Target section table/string reconstruction while preserving exact frame content and full redraw cadence.","anti_cheat":"Exact color function output cached by inputs; no frame skipping, cadence change, or benchmark edit."}}
{"run":3,"commit":"c97ce90","metric":4.124935398764535,"metrics":{"update_p95_ms":7.671696,"section_mean_us":125.143008,"section_alloc_kib":145.828515625,"core_mean_us":9.554072,"delivered_fps":11.20935777284596,"max_rss_kib":53268},"status":"keep","description":"Cache highlight names by filtered color and glow","timestamp":1784452140498,"segment":0,"confidence":26.331156628598592,"asi":{"hypothesis":"Each segment rebuilds the same highlight-name string; caching exact color/glow to name mappings removes repeated concatenation and lookup work.","finding":"Section mean fell another 38.4% from 203.2 µs to 125.1 µs. Primary CPU improved only 0.8% versus prior keep, likely near noise; redraw p95 recovered somewhat. Allocation metric unchanged, implying table/text construction now dominates.","next_action":"Measure a structural reduction in section text table/string allocation; avoid more tiny lookup tweaks.","anti_cheat":"Highlight semantics and names unchanged; cadence and full Snacks redraw preserved."}}
{"run":4,"commit":"cc66d40","metric":4.00976345066092,"metrics":{"update_p95_ms":7.992327,"section_mean_us":116.505366,"section_alloc_kib":0.00090625,"core_mean_us":10.999782,"delivered_fps":11.20986563499302,"max_rss_kib":52712},"status":"keep","description":"Reuse Snacks section and text entry tables","timestamp":1784452236992,"segment":0,"confidence":13.091542354246446,"asi":{"hypothesis":"Snacks consumes section text synchronously without mutating source entries, so reusing section and entry tables removes per-frame table allocation while preserving exact strings/highlights.","finding":"CPU improved 2.8% versus prior keep. Section allocation dropped from 145.8 KiB/call to ~0.001 KiB and mean improved 6.9%. Remaining section cost is string concatenation and traversal; full redraw still dominates.","safety":"Snacks block formatting creates child tables via metatables and reads source text; it does not mutate source entries. Generation/lifecycle checks and timer/FPS gates passed.","next_action":"Reduce repeated per-segment traversal/string concatenation using cacheable serialized rows, then validate real CPU."}}
{"run":5,"commit":"cc66d40","metric":4.043785824439693,"metrics":{"update_p95_ms":8.29535,"section_mean_us":3.906186,"section_alloc_kib":0,"core_mean_us":16.08767,"delivered_fps":11.21965262653988,"max_rss_kib":55388},"status":"discard","description":"Cache serialized row variants by segments and effect color","timestamp":1784452303848,"segment":0,"confidence":11.894105630094169,"asi":{"hypothesis":"Caching immutable serialized row variants should remove per-segment work after warmup and lower real dashboard CPU.","finding":"Micro section mean collapsed from 116.5 µs to 3.9 µs, but primary CPU worsened 0.85% and max RSS rose 5.1%. Full Snacks redraw dominates enough that a large persistent row cache does not pay back in the real workload.","rollback_reason":"Primary metric regressed and memory cost increased; this is benchmark-local over-optimization with no real workload win.","next_action_hint":"Stop optimizing section microbenchmark. Target work inside or around full Snacks redraw, especially avoiding redundant static dashboard recomputation without reducing delivered visual frames."}}
{"run":6,"commit":"cc66d40","metric":4.302004712427716,"metrics":{"update_p95_ms":8.436785,"section_mean_us":108.831316,"section_alloc_kib":0.52434375,"core_mean_us":12.661426,"delivered_fps":11.2175054218666,"max_rss_kib":52980},"status":"discard","description":"Cache active dashboard buffer to avoid repeated window scans","timestamp":1784452433315,"segment":0,"confidence":8.444318215906572,"asi":{"hypothesis":"Caching the active dashboard buffer should remove one all-window scan from each timer tick while retaining fallback discovery and cleanup.","finding":"Primary CPU worsened 7.3%. The scan is not material in the real workload, and section calls without a visible dashboard repeatedly attempted discovery, adding diagnostic allocation.","rollback_reason":"Clear primary regression with no compensating benefit.","next_action_hint":"Avoid lifecycle/window-scan micro-optimizations. Profile full redraw subphases or test smaller output representation changes."}}
{"run":7,"commit":"cc66d40","metric":4.127780900483907,"metrics":{"update_p95_ms":7.058173,"section_mean_us":121.940052,"section_alloc_kib":0.00090625,"core_mean_us":13.90744,"delivered_fps":11.21212706301283,"max_rss_kib":53284},"status":"discard","description":"Noise calibration rerun of current best","timestamp":1784452484640,"segment":0,"confidence":11.491168938864732,"asi":{"hypothesis":"Repeat current best unchanged to estimate run-to-run noise before pursuing riskier architecture changes.","finding":"CPU varied from 4.010% to 4.128% (+2.9%) with identical code; update p95 varied inversely. Future gains below ~3% need confirmation runs.","rollback_reason":"No code change and metric did not improve stored best.","next_action_hint":"Prioritize experiments expected to exceed 3% CPU improvement; confirm marginal wins before retaining complexity."}}
{"run":8,"commit":"f369147","metric":3.879477505681737,"metrics":{"update_p95_ms":7.70772,"section_mean_us":77.401066,"section_alloc_kib":0.00090625,"core_mean_us":14.572476,"delivered_fps":11.21407859015992,"max_rss_kib":53040},"status":"keep","description":"Use nested filtered-color cache keys","timestamp":1784452582067,"segment":0,"confidence":11.000692092712343,"asi":{"hypothesis":"Nested source->filter cache lookup avoids constructing and hashing a concatenated key for every segment while retaining exact memoized results.","finding":"CPU improved 3.25% versus stored best, just above measured ~3% run noise. Section mean improved 33.6% from 116.5 µs to 77.4 µs, providing a consistent causal signal. Cadence and memory held.","next_action":"Apply the same nested-key strategy to highlight-name cache, then require a real CPU win rather than relying on microbenchmark alone.","anti_cheat":"Only cache indexing changed; output, redraw count, and cadence unchanged."}}
{"run":9,"commit":"f369147","metric":4.003745318817922,"metrics":{"update_p95_ms":7.962297,"section_mean_us":78.003778,"section_alloc_kib":0.00090625,"core_mean_us":15.070226,"delivered_fps":11.21387219210016,"max_rss_kib":53068},"status":"discard","description":"Use nested highlight-name cache keys","timestamp":1784452636811,"segment":0,"confidence":9.511756741758552,"asi":{"hypothesis":"Nested color->glow lookup should avoid highlight cache key concatenation, mirroring the filtered-color cache win.","finding":"Primary CPU regressed 3.2% and section mean was unchanged. Highlight keys are already final color strings and concatenation/interning is cheaper than an extra nested lookup here.","rollback_reason":"Primary regression at roughly the measured noise threshold with no diagnostic improvement.","next_action_hint":"Do not generalize cache structures blindly. Keep nested cache only for source/filter tinting, where section timing proved the benefit."}}
{"run":10,"commit":"f369147","metric":4.194279667977193,"metrics":{"update_p95_ms":7.196804,"section_mean_us":84.416256,"section_alloc_kib":0.00090625,"core_mean_us":13.439808,"delivered_fps":11.21639579325394,"max_rss_kib":54036},"status":"discard","description":"Cache final highlight names per segment and filter","timestamp":1784452707033,"segment":0,"confidence":11.000692092712343,"asi":{"hypothesis":"A weak per-segment cache of final highlight names should fuse tint and highlight lookups for stable ANSI segments.","finding":"CPU regressed 8.1%, section mean worsened 9.1%, and RSS increased. Per-segment variant-table lookup and cache footprint cost more than the already-fast nested tint cache plus global highlight cache.","rollback_reason":"Strong primary and memory regression; extra cache layer is counterproductive.","next_action_hint":"Current hot section path is sufficiently optimized. Investigate reducing Snacks-render input complexity or accept architecture boundary as next ceiling."}}
{"run":11,"commit":"f369147","metric":4.089185457614094,"metrics":{"update_p95_ms":8.377534,"section_mean_us":97.161772,"section_alloc_kib":0.00090625,"core_mean_us":18.826742,"delivered_fps":11.21467370813995,"max_rss_kib":53012},"status":"discard","description":"Track line boundaries instead of searching newline strings","timestamp":1784452761103,"segment":0,"confidence":13.49960936887717,"asi":{"hypothesis":"Tracking the current line start should replace a per-segment string search used only to prevent cross-line merging.","finding":"CPU regressed 5.4% and section mean regressed 25.5%. Lua numeric/branch bookkeeping was slower than the optimized C string search on these short cached strings, or amplified JIT instability.","rollback_reason":"Both primary and targeted diagnostic regressed clearly.","next_action_hint":"Retain the simple newline find. Avoid replacing optimized C library operations with Lua branches without evidence."}}
{"run":12,"commit":"f369147","metric":3.953965278192553,"metrics":{"update_p95_ms":7.390877,"section_mean_us":72.717082,"section_alloc_kib":0.00090625,"core_mean_us":13.775234,"delivered_fps":11.21442389226783,"max_rss_kib":53172},"status":"discard","description":"Use numeric loops in Snacks section serialization","timestamp":1784452811109,"segment":0,"confidence":11.874160111989356,"asi":{"hypothesis":"Numeric loops should reduce iterator overhead in the 1,000-segment section hot path.","finding":"Section mean improved 6.1%, but primary CPU worsened 1.9%, inside measured noise and with no real-workload evidence. Whole redraw remains dominant.","rollback_reason":"Primary did not improve; micro-only gain is insufficient under anti-overfitting rule.","next_action_hint":"Do not keep section-loop tweaks without confirmed real CPU benefit. Consider a confirmation only if combined with a structural redraw improvement, not standalone."}}
{"type":"config","name":"Reduce dashboard logo redraw load with frame-aware measurement","metricName":"cpu_percent","metricUnit":"","bestDirection":"lower"}
{"run":13,"commit":"c0e794d","metric":4.132575620776842,"metrics":{"update_p95_ms":7.678996,"section_mean_us":79.256664,"section_alloc_kib":0.00090625,"core_mean_us":13.351612,"delivered_fps":11.22274619544464,"redraw_fps":11.22274619544464,"max_rss_kib":52540},"status":"keep","description":"Frame-aware baseline separating animation ticks from full redraws","timestamp":1784452981867,"segment":1,"confidence":null,"asi":{"hypothesis":"Separate generated animation frame rate from full Snacks redraw rate before evaluating incremental rendering.","finding":"Frame-aware baseline: 4.133% CPU, 11.223 delivered FPS, 11.223 full redraw FPS. Instrumentation preserves prior workload while enabling honest measurement of equivalent non-redraw visual updates.","measurement_change":"Added generic on_frame callback and redraw_fps metric. FPS gate now tracks generated frames, not User update events. Correctness test requires callback activity.","anti_cheat":"Change made and baselined before structural optimization; full redraw rate remains independently visible."}}
{"run":14,"commit":"c0e794d","metric":10.12391758319906,"metrics":{"update_p95_ms":3.587556,"section_mean_us":81.195734,"section_alloc_kib":0.00090625,"core_mean_us":12.004448,"delivered_fps":11.22513648775516,"redraw_fps":4.952266097539041,"max_rss_kib":44872},"status":"discard","description":"Animate stable highlight groups and redraw only geometry changes","timestamp":1784453120888,"segment":1,"confidence":null,"asi":{"hypothesis":"Stable line/shade highlight groups can animate color-only frames through nvim_set_hl and reserve full Snacks redraws for geometry glitches.","finding":"Full redraw rate fell from 11.22 to 4.95 FPS and redraw p95 halved, but CPU exploded from 4.13% to 10.12%. Hundreds of nvim_set_hl calls per frame cost more than Snacks buffer/extmark rebuilds. RSS fell because fewer redraw allocations, but CPU is decisive.","rollback_reason":"Primary CPU regressed 145%; direct highlight redefinition is the wrong rendering primitive at this group cardinality.","next_action_hint":"Do not pursue per-line/per-shade highlight animation. A viable incremental renderer would need far fewer mutable groups or direct batched extmark updates; record as deferred architecture work."}}
{"run":15,"commit":"2dd833a","metric":3.005297965877106,"metrics":{"update_p95_ms":1.635602,"section_mean_us":0.761682,"section_alloc_kib":0.0047265625,"core_mean_us":13.53879,"delivered_fps":11.22352905172632,"redraw_fps":4.951556934585141,"max_rss_kib":43552},"status":"keep","description":"Render logo colors through dedicated extmarks","timestamp":1784453305230,"segment":1,"confidence":1,"asi":{"hypothesis":"Use Snacks item.render to capture dashboard placement, render plain logo text once, and update only a dedicated logo extmark namespace on color frames; invoke full Snacks redraw only when glitch geometry changes.","finding":"CPU improved 27.3% from frame-aware baseline (4.133% -> 3.005%). Full redraw rate fell 56% to 4.95 FPS, redraw p95 fell 79% to 1.64 ms, RSS fell 17%, and delivered animation stayed 11.22 FPS. Dedicated extmark updates are much cheaper than whole-dashboard rebuild and much cheaper than mass nvim_set_hl.","safety":"Correctness test renders the custom namespace and asserts extmarks exist; generation, lifecycle, frame callback, timer cleanup, and FPS gates pass. Plain text remains owned by Snacks; only color extmarks are custom.","next_action":"Optimize dedicated extmark updates: preserve extmark IDs instead of clear/recreate, or skip unchanged geometry position discovery. Require real CPU improvement."}}
{"run":16,"commit":"7e24d30","metric":2.974728649932636,"metrics":{"update_p95_ms":1.20719,"section_mean_us":0.525834,"section_alloc_kib":0.0047265625,"core_mean_us":12.847172,"delivered_fps":11.22256526743591,"redraw_fps":4.952818202391948,"max_rss_kib":43044},"status":"keep","description":"Confirmation rerun of dedicated extmark renderer","timestamp":1784453340755,"segment":1,"confidence":2,"asi":{"hypothesis":"Repeat the dedicated-extmark implementation unchanged to confirm the large CPU reduction is not a one-run artifact.","finding":"Confirmed at 2.975% CPU, slightly better than 3.005%; delivered FPS and redraw rate remained stable. Structural improvement is reproducible.","next_action":"Reuse extmark IDs to avoid namespace clear/recreate on every frame; monitor CPU and correctness."}}
{"run":17,"commit":"7e24d30","metric":3.421934409907003,"metrics":{"update_p95_ms":1.379813,"section_mean_us":0.52551,"section_alloc_kib":0.0047265625,"core_mean_us":12.18457,"delivered_fps":11.21732799724864,"redraw_fps":4.948821175256755,"max_rss_kib":42672},"status":"discard","description":"Reuse dedicated logo extmark IDs across frames","timestamp":1784453413593,"segment":1,"confidence":2.5890698968424997,"asi":{"hypothesis":"Updating existing extmarks by ID should avoid namespace clearing and extmark allocation each frame.","finding":"CPU regressed 15.0% despite slightly lower RSS. Neovim's extmark update-by-ID path is more expensive here than clear-and-recreate, likely due tree relocation/lookups for every mark.","rollback_reason":"Large primary regression; namespace clear plus sequential creation is the faster native path for this workload.","next_action_hint":"Retain clear/recreate. Optimize Lua-side position/highlight preparation or reduce extmark calls only if visual equivalence can be proven."}}
{"run":18,"commit":"7e24d30","metric":3.954467834332567,"metrics":{"update_p95_ms":1.516068,"section_mean_us":0.4988,"section_alloc_kib":0.0047265625,"core_mean_us":14.485876,"delivered_fps":11.20851823333572,"redraw_fps":4.944934514706935,"max_rss_kib":41556},"status":"discard","description":"Cache logo columns between geometry redraws","timestamp":1784453542493,"segment":1,"confidence":2.0542356460479807,"asi":{"hypothesis":"Logo start columns are stable between geometry redraws; caching them should remove 35 string searches per color frame.","finding":"CPU regressed 32.9% while RSS fell. The string searches are trivial relative to extmark work; changed closure/table access or run variance outweighed them.","rollback_reason":"Severe primary regression with no meaningful targeted metric gain.","next_action_hint":"Leave position discovery inline. Focus on reducing number or cost of extmark API calls, not minor Lua bookkeeping."}}
{"run":19,"commit":"7e24d30","metric":3.150700847709972,"metrics":{"update_p95_ms":1.910016,"section_mean_us":0.788716,"section_alloc_kib":0.0047265625,"core_mean_us":12.646694,"delivered_fps":11.21745728746852,"redraw_fps":4.948878215059642,"max_rss_kib":41868},"status":"discard","description":"Second noise calibration of dedicated extmark renderer","timestamp":1784453576635,"segment":1,"confidence":2.5890698968424997,"asi":{"hypothesis":"Re-run current best after two surprising regressions to distinguish code effects from machine load noise.","finding":"Unchanged code measured 3.151% versus stored 2.975% (+5.9%), showing current machine noise/load is elevated. Large regressions remain valid, but future gains need repeated confirmation.","rollback_reason":"No code change and metric did not beat stored best.","next_action_hint":"Use structural experiments with large expected effects; repeat any apparent win before keeping additional complexity."}}
{"run":20,"commit":"7e24d30","metric":2.981806219059836,"metrics":{"update_p95_ms":1.393369,"section_mean_us":0.511138,"section_alloc_kib":0.0047265625,"core_mean_us":11.99301,"delivered_fps":11.2280477388097,"redraw_fps":4.953550473004281,"max_rss_kib":41672},"status":"discard","description":"Merge adjacent equal-color extmark spans","timestamp":1784453671954,"segment":1,"confidence":3.758630873222457,"asi":{"hypothesis":"Merging adjacent segments with the same final highlight should reduce extmark API calls by about 8% without visual change.","finding":"Measured 2.982% CPU, effectively tied with stored best 2.975% and better than the recent 3.151% noise calibration. No primary best improvement, so it cannot be kept. RSS and redraw metrics were healthy.","rollback_reason":"Primary metric was 0.24% worse than stored best; result is indistinguishable from noise.","next_action_hint":"Potentially revisit span merging only alongside a stronger extmark-call reduction or during a lower-noise confirmation window; do not keep standalone now."}}
{"run":21,"commit":"4045564","metric":2.943172920671882,"metrics":{"update_p95_ms":1.733866,"section_mean_us":0.516166,"section_alloc_kib":0.0047265625,"core_mean_us":14.46508,"delivered_fps":11.2264996351774,"redraw_fps":4.952867486107674,"max_rss_kib":41464},"status":"keep","description":"Skip foreground extmarks for whitespace-only segments","timestamp":1784453737417,"segment":1,"confidence":5.731289841712023,"asi":{"hypothesis":"About 16.4% of default logo segments contain only spaces; foreground-only extmarks on them are visually inert and can be omitted.","finding":"CPU improved 1.1% versus stored best and RSS fell 3.7%. Gain is below current noise, but change deletes roughly 184 useless extmark calls per frame and is visually exact because groups set only foreground/ctermfg.","next_action":"Confirm unchanged. If not repeatable, simplicity may still justify keeping only if primary remains non-regressive.","anti_cheat":"Text and animation unchanged; only foreground highlights on whitespace, which cannot affect rendered cells, are skipped."}}
