{"run":43,"commit":"18e925a","metric":1.003133268037208,"metrics":{"update_p95_ms":0,"section_mean_us":0.58155,"section_alloc_kib":0.0047265625,"core_mean_us":17.356208,"delivered_fps":11.20962644791246,"redraw_fps":0,"max_rss_kib":38360},"status":"keep","description":"Use default virtual-text highlight mode","timestamp":1784455407341,"segment":1,"confidence":4.126652459910835,"asi":{"hypothesis":"Virtual text defaults to replace-mode highlighting, so explicitly passing hl_mode='replace' is redundant option parsing on every line/frame.","finding":"CPU improved 6.8% from 1.077% to 1.003%. Delivered FPS and zero-redraw behavior held. Removing redundant configuration is both faster and simpler.","safety":"Neovim's default virtual-text highlight mode is replace; text reconstruction and lifecycle checks pass.","next_action":"Confirm. Then update autoresearch summary; remaining animation overhead is near 0.7-0.8 percentage points above measured idle."}}
{"run":44,"commit":"035bfa1","metric":0.9966531338898296,"metrics":{"update_p95_ms":0,"section_mean_us":0.512194,"section_alloc_kib":0.0047265625,"core_mean_us":16.272788,"delivered_fps":11.21232257783991,"redraw_fps":0,"max_rss_kib":38504},"status":"keep","description":"Confirmation rerun of default virtual-text highlight mode","timestamp":1784455463149,"segment":1,"confidence":3.9841485712489404,"asi":{"hypothesis":"Confirm the redundant-option removal unchanged.","finding":"Confirmed at 0.997% CPU with 11.21 FPS and zero redraws. Current best is reproducible near 1% process CPU.","next_action":"Update prompt summary and test only deletion/simplification experiments; practical renderer floor is close."}}
{"run":45,"commit":"035bfa1","metric":1.075796615658172,"metrics":{"update_p95_ms":0,"section_mean_us":0.524976,"section_alloc_kib":0.0047265625,"core_mean_us":13.98194,"delivered_fps":11.21945551578481,"redraw_fps":0,"max_rss_kib":36560},"status":"discard","description":"Remove display-chunk visibility flag","timestamp":1784455528701,"segment":1,"confidence":3.9408772494033433,"asi":{"hypothesis":"Adapter-compacted chunks are visible except all-space lines; removing the visibility field/branch should simplify hot chunk updates while foreground on spaces remains invisible.","finding":"CPU regressed 7.9% despite lower RSS. Highlighting all-space chunks adds enough C-side work to outweigh the removed Lua branch.","rollback_reason":"Primary regression; explicit visibility suppression remains worthwhile.","next_action_hint":"Keep visibility flag. Do not trade skipped rendering work for Lua branch deletion."}}
{"run":46,"commit":"035bfa1","metric":1.152144435521081,"metrics":{"update_p95_ms":0,"section_mean_us":0.543304,"section_alloc_kib":0.0047265625,"core_mean_us":15.493314,"delivered_fps":11.20570707927133,"redraw_fps":0,"max_rss_kib":37252},"status":"discard","description":"Skip virtual extmarks for blank logo lines","timestamp":1784455654940,"segment":1,"confidence":4.015074145884757,"asi":{"hypothesis":"Two all-whitespace logo lines need no overlay extmark; skip them while adjusting correctness expectations.","finding":"CPU regressed 15.6%. Per-chunk highlighted-state tracking costs more than two saved extmark calls.","rollback_reason":"Primary regression; blank-line extmarks are cheap and branch bookkeeping is not.","next_action_hint":"Keep unconditional one-extmark-per-line path. Avoid reductions with tiny call-count savings."}}
{"run":47,"commit":"035bfa1","metric":1.195271115255799,"metrics":{"update_p95_ms":0,"section_mean_us":0.526032,"section_alloc_kib":0.0047265625,"core_mean_us":16.10417,"delivered_fps":11.21117875497084,"redraw_fps":0,"max_rss_kib":37980},"status":"discard","description":"Clear entire logo namespace each frame","timestamp":1784455718249,"segment":1,"confidence":4.092118538898078,"asi":{"hypothesis":"Whole-namespace clearing may use a faster native path than a bounded logo row range.","finding":"CPU regressed 19.9%. Bounded row clearing is faster for the 35-line logo namespace.","rollback_reason":"Clear primary regression.","next_action_hint":"Keep bounded namespace clear. Renderer is near practical floor; remaining obvious API substitutions have been exhausted."}}
{"run":48,"commit":"035bfa1","metric":1.008733932869891,"metrics":{"update_p95_ms":0,"section_mean_us":0.532328,"section_alloc_kib":0.0047265625,"core_mean_us":16.341638,"delivered_fps":11.2105165343882,"redraw_fps":0,"max_rss_kib":37684},"status":"discard","description":"Assign cached virtual-text table only once","timestamp":1784455781590,"segment":1,"confidence":4.082473035162488,"asi":{"hypothesis":"Each line retains the same chunk table, so assigning extmark.virt_text every frame is redundant.","finding":"Measured 1.009% CPU, 1.2% worse than best and within noise. Simpler steady-state writes did not produce a measurable win.","rollback_reason":"Primary did not improve stored best.","next_action_hint":"Do not retain micro changes within noise under strict primary-metric rule."}}
{"run":49,"commit":"d4cf1fb","metric":0.985977004434053,"metrics":{"update_p95_ms":0,"section_mean_us":0.497798,"section_alloc_kib":0.0047265625,"core_mean_us":14.767498,"delivered_fps":11.20690607787846,"redraw_fps":0,"max_rss_kib":37804},"status":"keep","description":"Use captured dashboard lines directly for overlay placement","timestamp":1784455937730,"segment":1,"confidence":4.086738836868268,"asi":{"hypothesis":"Snacks item.render always provides a dashboard with populated lines; buffer-read fallback in every frame is unreachable and can be deleted.","finding":"CPU improved 1.1% and code simplified. Dashboard and fake correctness harness both provide lines; all checks pass.","safety":"No behavior fallback lost for supported Snacks integration because apply_highlights is only armed by section_item.render, after dashboard.lines is built.","next_action":"Confirm only if machine noise permits; remaining changes should be deletions with guaranteed invariants."}}
{"run":50,"commit":"d4cf1fb","metric":1.004712981914382,"metrics":{"update_p95_ms":0,"section_mean_us":0.505,"section_alloc_kib":0.0047265625,"core_mean_us":14.866312,"delivered_fps":11.20433680280192,"redraw_fps":0,"max_rss_kib":37436},"status":"discard","description":"Remove impossible missing-line fallback","timestamp":1784456006030,"segment":1,"confidence":4.204595333838863,"asi":{"hypothesis":"Captured dashboard row must exist; removing the empty-string fallback deletes one hot branch.","finding":"Measured 1.005% CPU, 1.9% worse than best and within noise. No measurable benefit.","rollback_reason":"Primary did not improve stored best.","next_action_hint":"Keep defensive empty-string fallback; deletion is not performance-relevant."}}
{"run":51,"commit":"bb74fc1","metric":0.9568921295462799,"metrics":{"update_p95_ms":0,"section_mean_us":0.498914,"section_alloc_kib":0.0047265625,"core_mean_us":18.686722,"delivered_fps":11.20801556607968,"redraw_fps":0,"max_rss_kib":37556},"status":"keep","description":"Update 35 line-level virtual extmarks by ID","timestamp":1784456097347,"segment":1,"confidence":4.369469667532397,"asi":{"hypothesis":"Extmark ID reuse was costly for ~841 range marks, but with only 35 line-level virtual extmarks it should beat clearing and reallocating the namespace each frame.","finding":"CPU improved 3.0% from 0.986% to 0.957%. This reverses the earlier result at the new lower cardinality: ID updates are beneficial only after batching to one extmark per line.","safety":"Line count is fixed for an integration, and set_extmark with an ID updates row, column, and chunks after geometry changes. Existing detailed extmark and lifecycle checks pass.","next_action":"Add close/reopen buffer coverage to ensure reused IDs create correctly in a new buffer; confirm performance."}}
{"run":52,"commit":"bb74fc1","metric":1.028071728060597,"metrics":{"update_p95_ms":0,"section_mean_us":0.536074,"section_alloc_kib":0.0047265625,"core_mean_us":13.45073,"delivered_fps":11.20479426413241,"redraw_fps":0,"max_rss_kib":36076},"status":"discard","description":"Confirmation rerun of line-level extmark ID reuse","timestamp":1784456164357,"segment":1,"confidence":4.678221003809493,"asi":{"hypothesis":"Confirm line-level extmark ID reuse and separately verify IDs can be recreated in a new dashboard buffer.","finding":"Unchanged code measured 1.028%, within current noise. Separate temporary reopen harness created all 35 extmarks in a second buffer using retained IDs successfully.","rollback_reason":"No code change and metric did not beat stored best.","next_action_hint":"Reopen safety is verified without production changes. Keep current implementation."}}
{"run":53,"commit":"bb74fc1","metric":0.9855179202259536,"metrics":{"update_p95_ms":0,"section_mean_us":0.57263,"section_alloc_kib":0.0047265625,"core_mean_us":13.445712,"delivered_fps":11.21236155368798,"redraw_fps":0,"max_rss_kib":37024},"status":"discard","description":"Store virtual extmark IDs inside option tables","timestamp":1784456222485,"segment":1,"confidence":5.033923337361707,"asi":{"hypothesis":"Option tables already persist per line; store returned extmark IDs there and eliminate separate ID storage plus repeated virt_text assignment.","finding":"CPU regressed 3.0%. Keeping IDs in a dense separate array is faster than reading/writing the mixed options table.","rollback_reason":"Primary regression at the edge of noise with no correctness benefit.","next_action_hint":"Retain separate virtual_ids array and explicit option updates."}}
{"run":54,"commit":"bb74fc1","metric":1.034640776798562,"metrics":{"update_p95_ms":0,"section_mean_us":0.510972,"section_alloc_kib":0.0047265625,"core_mean_us":13.17335,"delivered_fps":11.20398583404148,"redraw_fps":0,"max_rss_kib":37772},"status":"discard","description":"Preallocate per-line virtual text structures","timestamp":1784456294722,"segment":1,"confidence":5.049903267346278,"asi":{"hypothesis":"Preallocate 35 chunk/option tables after the initial frame to remove steady-state nil branches and field assignments.","finding":"CPU regressed 8.1%. Lazy initialization yields a better LuaJIT trace or memory layout than eager preallocation.","rollback_reason":"Clear primary regression.","next_action_hint":"Keep lazy per-line virtual structures. Stop preallocation experiments."}}
{"run":55,"commit":"bb74fc1","metric":1.039410041614943,"metrics":{"update_p95_ms":0,"section_mean_us":0.49507,"section_alloc_kib":0.0047265625,"core_mean_us":13.406124,"delivered_fps":11.2026695666354,"redraw_fps":0,"max_rss_kib":37224},"status":"discard","description":"Precompute ANSI shade ranks and cache merged display chunks","timestamp":1784456416822,"segment":1,"confidence":5.1048231512925675,"asi":{"hypothesis":"Precompute exact 16-level luminance rank per ANSI segment, merge equal-shade display chunks once per geometry, and remove per-frame chunk concatenation.","finding":"CPU regressed 8.6%. Extra segment metadata and cache-build complexity outweigh per-frame merge removal; the simple runtime merge is faster under LuaJIT.","rollback_reason":"Primary regression and significantly more cross-module complexity.","next_action_hint":"Keep shade computation implicit in cached filter_color and runtime chunk merge. Do not add parser metadata for adapter optimization."}}
{"run":56,"commit":"bb74fc1","metric":1.003757256820289,"metrics":{"update_p95_ms":0,"section_mean_us":0.498686,"section_alloc_kib":0.0047265625,"core_mean_us":13.0054,"delivered_fps":11.20632650288627,"redraw_fps":0,"max_rss_kib":37960},"status":"discard","description":"Avoid empty-string highlight key concatenation on normal frames","timestamp":1784456489979,"segment":1,"confidence":5.114391835396349,"asi":{"hypothesis":"Most frames are non-glow; use the color string directly as cache key/name input instead of concatenating an empty suffix.","finding":"CPU regressed 4.9%. Branching name/key construction is slower than the predictable concatenation path, likely due string interning and JIT trace stability.","rollback_reason":"Primary regression.","next_action_hint":"Keep uniform concatenation. Avoid glow-path branching micro-optimizations."}}
{"run":57,"commit":"bb74fc1","metric":1.10698462731209,"metrics":{"update_p95_ms":0,"section_mean_us":0.510158,"section_alloc_kib":0.0047265625,"core_mean_us":13.415924,"delivered_fps":11.2013204032152,"redraw_fps":0,"max_rss_kib":36628},"status":"discard","description":"Disable undo restoration for animated virtual extmarks","timestamp":1784456613620,"segment":1,"confidence":5.163732701472615,"asi":{"hypothesis":"Animated dashboard extmarks do not need undo restoration; disabling it should reduce mark bookkeeping without changing display or lifecycle.","finding":"CPU regressed 15.7% while correctness and FPS held. Extra option handling or alternate extmark path costs more than any undo bookkeeping saved in this nonmodifiable dashboard buffer.","rollback_reason":"Large primary regression; default undo_restore path is faster here.","next_action_hint":"Keep default extmark semantics. Next promising area is review-driven correctness/performance findings or reducing timer/core work, not more extmark flags."}}
{"run":58,"commit":"bb74fc1","metric":1.119706962173452,"metrics":{"update_p95_ms":0,"section_mean_us":0.511418,"section_alloc_kib":0.0047265625,"core_mean_us":15.35543,"delivered_fps":11.20127437083008,"redraw_fps":0,"max_rss_kib":37696},"status":"discard","description":"Skip line geometry comparisons on non-glitch frames","timestamp":1784456731066,"segment":1,"confidence":5.445402975099514,"asi":{"hypothesis":"Mark each generated frame with a has-glitch flag so geometry_changed can skip 35 line-string comparisons on color-only frames.","finding":"CPU regressed 17.0%. Maintaining frame-level glitch metadata in the effect hot loop costs more than optimized string identity/content comparisons in the adapter.","rollback_reason":"Large primary regression with unchanged behavior.","next_action_hint":"Keep direct line comparison. Geometry detection is not a meaningful remaining bottleneck."}}
{"run":59,"commit":"cf1648a","metric":0.9360648398252295,"metrics":{"update_p95_ms":0,"section_mean_us":0.524438,"section_alloc_kib":0.0047265625,"core_mean_us":15.270364,"delivered_fps":11.2037126298773,"redraw_fps":0,"max_rss_kib":37500},"status":"keep","description":"Use numeric highlight IDs in virtual-text chunks","timestamp":1784456838879,"segment":1,"confidence":5.4384516625653765,"asi":{"hypothesis":"Neovim accepts numeric highlight IDs in virt_text chunks; caching IDs should avoid repeated highlight-name string resolution/conversion for hundreds of chunks per frame.","finding":"CPU improved 2.2% from 0.957% to 0.936%. FPS and zero-redraw behavior held. A direct API probe verified numeric IDs are accepted, and full checks passed.","safety":"Named highlight groups are still created with nvim_set_hl; only the chunk reference changes from group name string to its stable numeric ID.","next_action":"Confirm under identical code. If stable, document numeric-ID use in autoresearch summary and wait for reviewer findings."}}
{"run":60,"commit":"cf1648a","metric":1.10482799513455,"metrics":{"update_p95_ms":0,"section_mean_us":0.503076,"section_alloc_kib":0.0047265625,"core_mean_us":15.996736,"delivered_fps":11.20611798565141,"redraw_fps":0,"max_rss_kib":37480},"status":"discard","description":"Cache numeric highlight IDs on display chunks","timestamp":1784456937149,"segment":1,"confidence":6.575092124307881,"asi":{"hypothesis":"Adapter display chunks persist across frames; caching final numeric highlight IDs by filter/glow should replace two global cache lookups with one local chunk lookup.","finding":"CPU regressed 18.0%. Per-chunk highlight tables create poor memory locality and lookup overhead; the global nested tint cache plus global highlight cache is faster.","rollback_reason":"Large primary regression with no correctness or memory benefit.","next_action_hint":"Do not attach per-filter caches to display chunks. Keep compact chunks data-only and shared global color/highlight caches."}}
{"run":61,"commit":"6f27a6a","metric":0.9062537772083071,"metrics":{"update_p95_ms":0,"section_mean_us":0.53302,"section_alloc_kib":0.0047265625,"core_mean_us":17.254378,"delivered_fps":11.21356300497941,"redraw_fps":0,"max_rss_kib":36948},"status":"keep","description":"Poll dashboard visibility every fourth rendered frame","timestamp":1784457057064,"segment":1,"confidence":7.635623001600499,"asi":{"hypothesis":"Once section.render captures a dashboard, polling all windows every frame is unnecessary; checking every fourth frame preserves sub-500ms cleanup while reducing steady API work.","finding":"CPU improved 3.2% from 0.936% to 0.906%; delivered FPS and zero-redraw behavior held. Lifecycle checks still stop the timer within 500ms after filetype removal.","safety":"Before a dashboard is captured, visibility is still checked every tick. Captured dashboards poll every four ticks, bounding stale timer lifetime to roughly 360ms.","next_action":"Reviewer found correctness defects in variable-height effects and display-cache metadata. Fix those before further optimization, then confirm numeric-ID and polling gains against noise."}}
{"run":62,"commit":"6f27a6a","metric":1.182220894925979,"metrics":{"update_p95_ms":0,"section_mean_us":0.502696,"section_alloc_kib":0.0047265625,"core_mean_us":13.105766,"delivered_fps":11.19695540924544,"redraw_fps":0,"max_rss_kib":37900},"status":"checks_failed","description":"Fallback and clear stale extmarks for variable-height effects","timestamp":1784457182728,"segment":1,"confidence":7.997565909360629,"asi":{"hypothesis":"When an effect changes frame height, bypass direct row replacement, clear retained line extmarks, and force the existing full Snacks update fallback; add a deterministic variable-height regression test.","finding":"Benchmark behavior remained default fixed-height, but new correctness checks failed with suppressed Neovim output. The implementation/test is not safe to keep without diagnosis.","rollback_reason":"Backpressure checks failed; variable-height regression harness or fallback logic has an unresolved error.","next_action_hint":"Run tests/snacks.lua unsuppressed to capture the exact assertion, then fix the regression harness or fallback as a fresh experiment. Reviewer defect remains open."}}
{"run":63,"commit":"6f27a6a","metric":1.054979372002734,"metrics":{"update_p95_ms":0,"section_mean_us":0.541476,"section_alloc_kib":0.0047265625,"core_mean_us":17.58441,"delivered_fps":11.19900672768208,"redraw_fps":0,"max_rss_kib":37268},"status":"discard","description":"Fallback and test variable-height effect rendering","timestamp":1784457333129,"segment":1,"confidence":8.564427727530344,"asi":{"hypothesis":"Use previous/current frame counts in the timer update path to force full Snacks fallback and clear retained IDs for variable-height effects; deterministic test simulates the fallback.","finding":"Correctness test passed after fixing fake buffer modifiability, proving the defect and intended fallback. However default fixed-height CPU regressed 16.4%, so hot-path frame-count bookkeeping is unacceptable.","rollback_reason":"Primary regression on the default workload; correctness fix must move entirely out of the per-frame hot path.","next_action_hint":"Track rendered height in section_item.render. Let update_geometry reject mismatched height only when geometry already changed, and clear/reset custom extmarks during fallback render. Reuse the deterministic variable-height test."}}
{"run":64,"commit":"6f27a6a","metric":1.016942272098074,"metrics":{"update_p95_ms":0,"section_mean_us":0.5044,"section_alloc_kib":0.0047265625,"core_mean_us":14.394512,"delivered_fps":11.20654398884936,"redraw_fps":0,"max_rss_kib":37468},"status":"discard","description":"Track rendered height only at Snacks render boundary","timestamp":1784457451731,"segment":1,"confidence":9.626801339948662,"asi":{"hypothesis":"Store rendered frame height in section_item.render, reject direct geometry only when a geometry update sees a height mismatch, and clear IDs during the rare fallback render.","finding":"Variable-height regression test passed and stale rows/extmarks were fixed. Default CPU still regressed 12.2%; even a rare-path rendered-height comparison perturbs the optimized trace too much.","rollback_reason":"Primary regression on default workload; fix cannot remain in shared update_geometry trace.","next_action_hint":"Declare fixed-height capability on effects. Select direct geometry function once during setup for fixed-height built-ins; custom effects without capability always use full update. This should fix correctness with zero default hot-path height checks."}}
{"run":65,"commit":"6f27a6a","metric":0.9859474648403029,"metrics":{"update_p95_ms":0,"section_mean_us":0.522596,"section_alloc_kib":0.0047265625,"core_mean_us":17.808662,"delivered_fps":11.20747300059596,"redraw_fps":0,"max_rss_kib":38284},"status":"discard","description":"Select fixed-height rendering capability once per effect","timestamp":1784457580877,"segment":1,"confidence":12.258644451800372,"asi":{"hypothesis":"Declare built-in effects fixed-height and choose direct versus fallback geometry function once during setup, fixing variable-height custom effects without per-frame count checks.","finding":"Variable-height regression test passed and stale rows/extmarks were removed. Default CPU still regressed 8.8%; adding animation capability metadata/function indirection perturbed the optimized core/adapter trace.","rollback_reason":"Primary regression on default workload despite correctness improvement.","next_action_hint":"Keep core animation unchanged. In Snacks setup, recognize built-in fixed-height effect names (`nil/default`, `glitch`, `none`) locally and select the existing direct function; custom effects use fallback. This avoids animation metadata and cross-module changes."}}
