{"run":66,"commit":"6f27a6a","metric":1.018329074513928,"metrics":{"update_p95_ms":0,"section_mean_us":0.498906,"section_alloc_kib":0.0047265625,"core_mean_us":15.601076,"delivered_fps":11.2066413895135,"redraw_fps":0,"max_rss_kib":37840},"status":"discard","description":"Select custom-effect fallback locally in Snacks adapter","timestamp":1784457663337,"segment":1,"confidence":13.64366381283018,"asi":{"hypothesis":"Recognize built-in effect table identities locally, leave default direct geometry function unchanged, and replace it only for custom effects; clear IDs on custom-effect renders.","finding":"Variable-height correctness test passed, but default CPU regressed 12.4%. Capturing fixed-height policy in the shared setup/render closure still perturbs the optimized default trace.","rollback_reason":"Primary regression on target workload despite correctness improvement.","next_action_hint":"Separate custom-effect fallback into an outer wrapper or distinct section render callback so the built-in default closure contains no policy upvalue/branch. Alternatively restrict optimized adapter API to built-ins and expose a separate conservative setup path."}}
{"run":67,"commit":"6f27a6a","metric":1.010717328487619,"metrics":{"update_p95_ms":0,"section_mean_us":0.501732,"section_alloc_kib":0.0047265625,"core_mean_us":14.495618,"delivered_fps":11.2051727691397,"redraw_fps":0,"max_rss_kib":36528},"status":"discard","description":"Route custom effects to isolated conservative adapter","timestamp":1784457824829,"segment":1,"confidence":14.408527517477959,"asi":{"hypothesis":"Keep optimized built-in closure free of policy branches by dispatching custom effects to a separate conservative full-update adapter before setup.","finding":"Variable-height and stale optimized extmark tests passed, but default CPU regressed 11.5%. Renaming/wrapping the optimized setup function itself changes the hot closure/JIT shape enough to lose performance.","rollback_reason":"Primary regression on target workload.","next_action_hint":"Preserve `function M.setup` and its optimized body byte-for-byte. Add only an early custom-effect return at the top, calling a separately defined conservative helper; do not wrap or rename the default function."}}
{"run":68,"commit":"6f27a6a","metric":1.048732714273496,"metrics":{"update_p95_ms":0,"section_mean_us":0.497124,"section_alloc_kib":0.0047265625,"core_mean_us":15.42863,"delivered_fps":11.20361801573595,"redraw_fps":0,"max_rss_kib":37584},"status":"discard","description":"Early-return custom effects to conservative adapter","timestamp":1784457923228,"segment":1,"confidence":14.879131482481906,"asi":{"hypothesis":"Preserve optimized M.setup body and hot closures unchanged; add only a setup-time early return for non-built-in effects to a separate conservative adapter.","finding":"Variable-height and stale-extmark tests passed, but default CPU regressed 15.7%. Even the setup-time dispatch changes generated closure/JIT behavior enough to lose the current best.","rollback_reason":"Large primary regression on target workload.","next_action_hint":"Do not modify optimized M.setup dispatch. Preserve current built-in path and document custom-effect limitation, or expose a separate opt-in `setup_conservative` API without changing M.setup. Correctness fix cannot enter target hot module under current strict metric."}}
{"run":69,"commit":"1856951","metric":0.8830900732455124,"metrics":{"update_p95_ms":0,"section_mean_us":0.548436,"section_alloc_kib":0.0047265625,"core_mean_us":16.231624,"delivered_fps":11.21145098138932,"redraw_fps":0,"max_rss_kib":37672},"status":"keep","description":"Skip unchanged line virtual-extmark updates","timestamp":1784458035847,"segment":1,"confidence":14.421086194013697,"asi":{"hypothesis":"Repeated glitch palette colors leave many lines with identical text, segment table, filter, and glow between frames; skip native extmark updates only when all four inputs are unchanged.","finding":"CPU improved 2.6% from 0.906% to 0.883%. Delivered FPS stayed 11.21 and zero full redraws held. This is a real rendering optimization: frames still tick, but exact unchanged line decorations are not resent.","anti_cheat":"Skip predicate includes line text, segment identity, filter, and glow. Any visible input change forces chunk rebuild/extmark update; render callbacks invalidate all signatures after layout changes.","next_action":"Confirm. Then fix display cache metadata key so same-text custom segment changes cannot reuse stale chunks; keep that correctness path outside default hot updates if possible."}}
{"run":70,"commit":"1856951","metric":0.8851450660425234,"metrics":{"update_p95_ms":0,"section_mean_us":0.49929,"section_alloc_kib":0.0047265625,"core_mean_us":15.313898,"delivered_fps":11.21410400393643,"redraw_fps":0,"max_rss_kib":36432},"status":"discard","description":"Confirmation rerun of unchanged-line extmark skipping","timestamp":1784458101478,"segment":1,"confidence":14.723262330661441,"asi":{"hypothesis":"Repeat the unchanged-line skip implementation before further tuning because its 2.6% gain is within documented run-to-run noise.","finding":"Confirmed at 0.885% versus stored 0.883% (+0.23%), effectively identical. Delivered FPS, zero redraws, and checks remained stable. The optimization is reproducible within noise, not a benchmark fluke.","rollback_reason":"No code change and metric did not beat stored best.","next_action_hint":"Proceed from 0.883% current best. Prioritize correctness of display-cache metadata or material native-call reductions; avoid interpreting sub-2% deltas."}}
{"run":71,"commit":"1856951","metric":0.8865037761379326,"metrics":{"update_p95_ms":0,"section_mean_us":0.540476,"section_alloc_kib":0.0047265625,"core_mean_us":13.217254,"delivered_fps":11.20930006297421,"redraw_fps":0,"max_rss_kib":37452},"status":"discard","description":"Key display chunk cache by segment table identity","timestamp":1784458188921,"segment":1,"confidence":14.688892301183579,"asi":{"hypothesis":"Use weak segment-table identity as the display cache key. This fixes same-text/different-segment metadata correctness and reduces normal-frame lookup depth; shifted transient tables are collected.","finding":"Measured 0.887% versus 0.883% best (+0.39%), effectively tied but not an improvement under strict primary rules. Checks passed and cache correctness is stronger, but no retained CPU win.","rollback_reason":"Primary metric did not beat stored best; correctness-only change cannot be kept in this strict loop.","next_action_hint":"If correctness priority overrides strict primary later, reconsider this near-neutral fix with an explicit same-text/color regression test. For autoresearch, pursue a material gain first, then fold the safer key into that experiment."}}
{"run":72,"commit":"1856951","metric":0,"metrics":{"update_p95_ms":0,"section_mean_us":0,"section_alloc_kib":0,"core_mean_us":0,"delivered_fps":0,"redraw_fps":0,"max_rss_kib":0},"status":"crash","description":"Separate animation and visibility polling timers","timestamp":1784458303487,"segment":1,"confidence":14.688892301183579,"asi":{"hypothesis":"Move dashboard visibility polling to a second 360ms timer so the 90ms animation callback contains only animation.tick, preserving cadence while removing per-frame counter/branch work.","finding":"Measurement command exited 1 before emitting metrics. Likely lifecycle/timer interaction, anti-cheat FPS gate, or soak process failure; no benchmark result is valid.","rollback_reason":"Experiment crashed; dual-timer implementation was auto-reverted.","next_action_hint":"Reproduce `.auto/measure.sh` components unsuppressed to identify whether failure is timer cleanup, delivered FPS, or Neovim error before retrying."}}
{"run":73,"commit":"1856951","metric":0.969946614132421,"metrics":{"update_p95_ms":0,"section_mean_us":0.77848,"section_alloc_kib":0.0047265625,"core_mean_us":16.497614,"delivered_fps":11.20834209052364,"redraw_fps":0,"max_rss_kib":37424},"status":"discard","description":"Separate animation and 180ms visibility timers","timestamp":1784458390690,"segment":1,"confidence":14.86157833896258,"asi":{"hypothesis":"A dedicated 180ms visibility timer satisfies the 280ms cleanup gate while removing visibility counters/branches from the 90ms animation callback.","finding":"Crash was resolved and cleanup/checks passed, confirming the prior failure was the 360ms cleanup window. CPU regressed 9.8%; a second timer and extra scheduled callback cost more than the removed per-frame bookkeeping.","rollback_reason":"Primary regression on valid workload.","next_action_hint":"Keep single timer with every-fourth-frame polling. Dual timers are operationally correct at 180ms but slower."}}
{"run":74,"commit":"0adad7a","metric":0.8638659544517311,"metrics":{"update_p95_ms":0,"section_mean_us":0.505284,"section_alloc_kib":0.0047265625,"core_mean_us":12.182168,"delivered_fps":11.21073253438573,"redraw_fps":0,"max_rss_kib":37548},"status":"keep","description":"Cache shifted segment geometry by source and offset","timestamp":1784458546131,"segment":1,"confidence":14.597017835611219,"asi":{"hypothesis":"Cache shifted segment arrays by immutable source segments and offset, then key display chunks by segment-table identity. Repeated glitch geometry reuses exact metadata while custom same-text segment changes cannot hit stale cache entries.","finding":"CPU improved 2.2% from 0.883% to 0.864%; core mean improved 25%. FPS and zero redraws held. The previous near-neutral identity cache becomes a win once shifted identities are stable.","correctness":"Display cache now keys segment metadata directly, fixing the reviewer-reported same-text/different-color stale-cache defect for effects that produce distinct segment tables. Shifted geometry remains exact and immutable.","anti_cheat":"No frames, colors, or redraw-required geometry are skipped. Only deterministic segment transformation and display preparation are memoized.","next_action":"Confirm. Then add an explicit same-text/different-segment-color regression test or address the documented custom variable-height limitation outside the optimized setup path."}}
{"run":75,"commit":"0adad7a","metric":0.9077828290452536,"metrics":{"update_p95_ms":0,"section_mean_us":0.53026,"section_alloc_kib":0.0047265625,"core_mean_us":11.969054,"delivered_fps":11.20911159722669,"redraw_fps":0,"max_rss_kib":36644},"status":"discard","description":"Confirmation rerun of shifted segment geometry cache","timestamp":1784458603764,"segment":1,"confidence":14.99910035988861,"asi":{"hypothesis":"Repeat the shifted-segment identity cache unchanged because its 2.2% CPU gain is within documented noise.","finding":"CPU measured 0.908% versus stored 0.864% (+5.1%), while core mean remained improved at 11.97 µs. Real process CPU is noisy; the deterministic core improvement and metadata correctness remain, but the small total-CPU gain is not independently reproduced.","rollback_reason":"No code change and metric did not beat stored best.","next_action_hint":"Keep current code per prior primary win, but avoid claiming precise 2.2% process gain. Add a direct regression test for same-text/different-segment metadata before further tuning."}}
{"run":76,"commit":"0adad7a","metric":0.8835800615648651,"metrics":{"update_p95_ms":0,"section_mean_us":0.528128,"section_alloc_kib":0.0047265625,"core_mean_us":10.637952,"delivered_fps":11.20930238377469,"redraw_fps":0,"max_rss_kib":37624},"status":"discard","description":"Cache shifted line strings by source and offset","timestamp":1784458704236,"segment":1,"confidence":15.313473382272864,"asi":{"hypothesis":"Shifted segment geometry is cached; cache matching shifted line strings by immutable source line and offset to remove repeated concatenation/substrings and accelerate identity comparisons.","finding":"Core mean improved 11.1% from the confirmation run (11.97 µs to 10.64 µs), but total CPU measured 0.884% versus 0.864% best (+2.3%). The core win is too small to affect the real renderer reliably.","rollback_reason":"Primary metric did not improve stored best; reject micro-only optimization under anti-overfitting rule.","next_action_hint":"Do not optimize core string work further. Remaining meaningful work is correctness regression coverage or native renderer behavior."}}
